{"activation_nonce":"5555555555555555555555555555555555555555555555555555555555555555","adapter":{"id":"fixture-adapter","version":"1"},"authority_id":"ddf9611510d07a74ac9cba1e2a526c59c2f0f9b7887422a50e3e1cfbb9755c25","authority_version":1,"base_profile":{"base_profile_sha256":"1111111111111111111111111111111111111111111111111111111111111111","exclusions_sha256":"4f53cda18c2baa0c0354bb5f9a3ecbe5ed12ab4d8e11ba873c2f11161202b945"},"declaration":{"device":79,"gid":0,"inode":39,"mode":"0644","nlink":1,"path":"/var/lib/synthetic-admin/dependency/layout-b/declaration.json","sha256":"ff1b6c33b747a416325b44b713d2d4d4073efff90595aca32fa3a4212fc2e63b","size":1400,"uid":0},"destination_policy":{"allowed_roots":["/srv/synthetic-runtime/v2"],"provider_destination":"/srv/synthetic-runtime/v2/bin/codex"},"limits":{"aggregate_file_bytes":2147483648,"authority_bytes":131072,"declaration_bytes":16777216,"entry_count":1024,"file_bytes":536870912,"link_text_bytes":4096,"path_bytes":4096},"owner_mode_policy":{"allowed_gids":[0],"allowed_uids":[0],"directory_modes":["0755"],"file_modes":["0644","0755"],"single_link_files":true,"symlink_mode":"0777"},"provenance":{"adapter_evidence_sha256":"4444444444444444444444444444444444444444444444444444444444444444","issuer":"fixture","upstream_manifest_sha256":"3333333333333333333333333333333333333333333333333333333333333333","upstream_receipt_sha256":"2222222222222222222222222222222222222222222222222222222222222222"},"schema":"org.agent-harness.executable-dependency-authority.v1","source_roots":[{"device":79,"gid":0,"inode":21,"mode":"0755","path":"/srv/synthetic-runtime/v2","uid":0}],"subject":{"executable":{"device":79,"gid":0,"inode":23,"mode":"0755","nlink":1,"path":"/srv/synthetic-runtime/v2/bin/codex","sha256":"a622b10ddc23c8c9e9ec39d4833ae9b7b772ef40cb430425cb1689b76ec3490c","size":7,"uid":0},"provider":"codex"}}